{
  "schemaVersion": 1,
  "artifact": "ecosystem-census",
  "generatedBy": "npm run docs:ecosystem",
  "censusId": "mjolnir-ecosystem-census",
  "observedAt": "2026-09-28",
  "baseSha": "a806496160aeefe64c1795823f90b64cce582835",
  "counts": {
    "entries": 33,
    "state:TARGET": 33,
    "maturity:M1": 24,
    "maturity:M2": 9
  },
  "entries": [
    {
      "id": "ec.api-contract-testing.bruno",
      "name": "Bruno",
      "category": "api-contract-testing",
      "state": "TARGET",
      "owner": "ecosystem-census",
      "observedAt": "2026-09-28",
      "signals": [
        {
          "kind": "manifest-file",
          "path": "bruno.json"
        }
      ],
      "adapter": null,
      "blocksAxes": ["API QA", "Discovery"],
      "successor": null,
      "removalDate": null,
      "notApplicableReason": null,
      "handledUpstreamMajors": [],
      "upstreamPackages": [
        {
          "ecosystem": "any",
          "name": "Bruno"
        }
      ],
      "revisitTrigger": "census gap generator reports this entry in the field backlog; promote only with adapter + corpus proof",
      "nextLevelGap": {
        "target": "M2_IMPLEMENTED",
        "missing": [
          "implementation exists",
          "unit tests for the implementation"
        ],
        "owner": "ecosystem-census",
        "revisitTrigger": "census gap generator reports this entry in the field backlog; promote only with adapter + corpus proof"
      },
      "maturity": "M1_DECLARED"
    },
    {
      "id": "ec.api-contract-testing.karate",
      "name": "Karate",
      "category": "api-contract-testing",
      "state": "TARGET",
      "owner": "ecosystem-census",
      "observedAt": "2026-09-28",
      "signals": [
        {
          "kind": "dependency",
          "ecosystem": "maven",
          "name": "com.intuit.karate"
        }
      ],
      "adapter": null,
      "blocksAxes": ["API QA", "Contract Coverage"],
      "successor": null,
      "removalDate": null,
      "notApplicableReason": null,
      "handledUpstreamMajors": [],
      "upstreamPackages": [
        {
          "ecosystem": "any",
          "name": "Karate"
        }
      ],
      "revisitTrigger": "census gap generator reports this entry in the field backlog; promote only with adapter + corpus proof",
      "nextLevelGap": {
        "target": "M2_IMPLEMENTED",
        "missing": [
          "implementation exists",
          "unit tests for the implementation"
        ],
        "owner": "ecosystem-census",
        "revisitTrigger": "census gap generator reports this entry in the field backlog; promote only with adapter + corpus proof"
      },
      "maturity": "M1_DECLARED"
    },
    {
      "id": "ec.api-contract-testing.pact",
      "name": "Pact",
      "category": "api-contract-testing",
      "state": "TARGET",
      "owner": "ecosystem-census",
      "observedAt": "2026-09-28",
      "signals": [
        {
          "kind": "dependency",
          "ecosystem": "npm",
          "name": "@pact-foundation/pact"
        }
      ],
      "adapter": null,
      "blocksAxes": ["API QA", "Contract Quality"],
      "successor": null,
      "removalDate": null,
      "notApplicableReason": null,
      "handledUpstreamMajors": [],
      "upstreamPackages": [
        {
          "ecosystem": "any",
          "name": "Pact"
        }
      ],
      "revisitTrigger": "census gap generator reports this entry in the field backlog; promote only with adapter + corpus proof",
      "nextLevelGap": {
        "target": "M2_IMPLEMENTED",
        "missing": [
          "implementation exists",
          "unit tests for the implementation"
        ],
        "owner": "ecosystem-census",
        "revisitTrigger": "census gap generator reports this entry in the field backlog; promote only with adapter + corpus proof"
      },
      "maturity": "M1_DECLARED"
    },
    {
      "id": "ec.api-contract-testing.postman-newman",
      "name": "Postman / Newman",
      "category": "api-contract-testing",
      "state": "TARGET",
      "owner": "ecosystem-census",
      "observedAt": "2026-09-28",
      "signals": [
        {
          "kind": "dependency",
          "ecosystem": "npm",
          "name": "newman"
        }
      ],
      "adapter": null,
      "blocksAxes": ["API QA", "Artifact Analysis"],
      "successor": null,
      "removalDate": null,
      "notApplicableReason": null,
      "handledUpstreamMajors": [],
      "upstreamPackages": [
        {
          "ecosystem": "any",
          "name": "Postman / Newman"
        }
      ],
      "revisitTrigger": "census gap generator reports this entry in the field backlog; promote only with adapter + corpus proof",
      "nextLevelGap": {
        "target": "M2_IMPLEMENTED",
        "missing": [
          "implementation exists",
          "unit tests for the implementation"
        ],
        "owner": "ecosystem-census",
        "revisitTrigger": "census gap generator reports this entry in the field backlog; promote only with adapter + corpus proof"
      },
      "maturity": "M1_DECLARED"
    },
    {
      "id": "ec.api-contract-testing.rest-assured",
      "name": "REST Assured",
      "category": "api-contract-testing",
      "state": "TARGET",
      "owner": "ecosystem-census",
      "observedAt": "2026-09-28",
      "signals": [
        {
          "kind": "dependency",
          "ecosystem": "maven",
          "name": "io.rest-assured"
        }
      ],
      "adapter": null,
      "blocksAxes": ["API QA", "Contract Coverage"],
      "successor": null,
      "removalDate": null,
      "notApplicableReason": null,
      "handledUpstreamMajors": [],
      "upstreamPackages": [
        {
          "ecosystem": "any",
          "name": "REST Assured"
        }
      ],
      "revisitTrigger": "census gap generator reports this entry in the field backlog; promote only with adapter + corpus proof",
      "nextLevelGap": {
        "target": "M2_IMPLEMENTED",
        "missing": [
          "implementation exists",
          "unit tests for the implementation"
        ],
        "owner": "ecosystem-census",
        "revisitTrigger": "census gap generator reports this entry in the field backlog; promote only with adapter + corpus proof"
      },
      "maturity": "M1_DECLARED"
    },
    {
      "id": "ec.bdd-spec-dsl.cucumber",
      "name": "Cucumber",
      "category": "bdd-spec-dsl",
      "state": "TARGET",
      "owner": "ecosystem-census",
      "observedAt": "2026-09-28",
      "signals": [
        {
          "kind": "dependency",
          "ecosystem": "npm",
          "name": "@cucumber/cucumber"
        }
      ],
      "adapter": null,
      "blocksAxes": ["Discovery", "Static Analysis"],
      "successor": null,
      "removalDate": null,
      "notApplicableReason": null,
      "handledUpstreamMajors": [],
      "upstreamPackages": [
        {
          "ecosystem": "any",
          "name": "Cucumber"
        }
      ],
      "revisitTrigger": "census gap generator reports this entry in the field backlog; promote only with adapter + corpus proof",
      "nextLevelGap": {
        "target": "M2_IMPLEMENTED",
        "missing": [
          "implementation exists",
          "unit tests for the implementation"
        ],
        "owner": "ecosystem-census",
        "revisitTrigger": "census gap generator reports this entry in the field backlog; promote only with adapter + corpus proof"
      },
      "maturity": "M1_DECLARED"
    },
    {
      "id": "ec.bdd-spec-dsl.specflow",
      "name": "SpecFlow",
      "category": "bdd-spec-dsl",
      "state": "TARGET",
      "owner": "ecosystem-census",
      "observedAt": "2026-09-28",
      "signals": [
        {
          "kind": "dependency",
          "ecosystem": "nuget",
          "name": "SpecFlow"
        }
      ],
      "adapter": null,
      "blocksAxes": ["Discovery", "Static Analysis"],
      "successor": null,
      "removalDate": null,
      "notApplicableReason": null,
      "handledUpstreamMajors": [],
      "upstreamPackages": [
        {
          "ecosystem": "any",
          "name": "SpecFlow"
        }
      ],
      "revisitTrigger": "census gap generator reports this entry in the field backlog; promote only with adapter + corpus proof",
      "nextLevelGap": {
        "target": "M2_IMPLEMENTED",
        "missing": [
          "implementation exists",
          "unit tests for the implementation"
        ],
        "owner": "ecosystem-census",
        "revisitTrigger": "census gap generator reports this entry in the field backlog; promote only with adapter + corpus proof"
      },
      "maturity": "M1_DECLARED"
    },
    {
      "id": "ec.ci-cd-provider.azure-pipelines",
      "name": "azure-pipelines",
      "category": "ci-cd-provider",
      "state": "TARGET",
      "owner": "provider-capability-contract",
      "observedAt": "2026-09-28",
      "signals": [
        {
          "kind": "manifest-file",
          "path": "azure-pipelines.yml"
        }
      ],
      "adapter": "azure-pipelines",
      "blocksAxes": ["CI Integrity", "False-Green Detection"],
      "successor": null,
      "removalDate": null,
      "notApplicableReason": null,
      "handledUpstreamMajors": ["2024"],
      "upstreamPackages": [],
      "revisitTrigger": "CI-IR adapter no longer normalizes a azure-pipelines pipeline construct; census staleness trigger demotes SUPPORTED",
      "nextLevelGap": {
        "target": "M3_FIXTURE_VERIFIED",
        "missing": [
          "the fixture quad for azure-pipelines is not complete — MUST-FIRE, MUST-NOT-FIRE, RECALL and PRECISION are the M3 criteria (evidence: fixtureQuadVerified); `npm run check-fixture-quad` prints the per-leg work list"
        ],
        "owner": "provider-capability-contract",
        "revisitTrigger": "CI-IR adapter no longer normalizes a azure-pipelines pipeline construct; census staleness trigger demotes SUPPORTED"
      },
      "maturity": "M2_IMPLEMENTED"
    },
    {